{
  "family": {
    "id": "opdb.g48w3.d235ace0",
    "manufacturer": "Stern",
    "opdb_id": "G48w3",
    "title": "Monopoly"
  },
  "format": "pinmame-machine-family",
  "members": [
    {
      "machine_id": "stern.monopoly.2001"
    }
  ],
  "schema_version": 1,
  "sources": [
    {
      "acquired_at": "2026-08-14T17:53:43Z",
      "attribution": "Open Pinball Database contributors",
      "id": "opdb.snapshot.690f784a7968",
      "kind": "human_review",
      "license": "NOASSERTION",
      "locator": "machineGroups[G48w3] and records G48w3-Mq1Zk",
      "revision": "690f784a7968987e39ef20e1aff7bd15ea0d67385bafb5556a027802d2032c93",
      "sha256": "690f784a7968987e39ef20e1aff7bd15ea0d67385bafb5556a027802d2032c93",
      "uri": "https://mp-data.sfo3.cdn.digitaloceanspaces.com/latest-opdb.json"
    }
  ]
}
