{
  "family": {
    "id": "opdb.gr6d8.d892d635",
    "manufacturer": "Williams",
    "opdb_id": "GR6d8",
    "title": "Star Trek: The Next Generation"
  },
  "format": "pinmame-machine-family",
  "members": [
    {
      "machine_id": "williams.star-trek-the-next-generation.1993"
    }
  ],
  "schema_version": 1,
  "sources": [
    {
      "acquired_at": "2026-08-14T17:53:43Z",
      "attribution": "Open Pinball Database contributors",
      "id": "opdb.snapshot.690f784a7968",
      "kind": "human_review",
      "license": "NOASSERTION",
      "locator": "machineGroups[GR6d8] and records GR6d8-M1rZd",
      "revision": "690f784a7968987e39ef20e1aff7bd15ea0d67385bafb5556a027802d2032c93",
      "sha256": "690f784a7968987e39ef20e1aff7bd15ea0d67385bafb5556a027802d2032c93",
      "uri": "https://mp-data.sfo3.cdn.digitaloceanspaces.com/latest-opdb.json"
    }
  ]
}
