{
  "family": {
    "id": "opdb.gr0lw.65726c81",
    "manufacturer": "Bally",
    "opdb_id": "GR0lW",
    "title": "Popeye Saves the Earth"
  },
  "format": "pinmame-machine-family",
  "members": [
    {
      "machine_id": "bally.popeye-saves-the-earth.1994"
    }
  ],
  "schema_version": 1,
  "sources": [
    {
      "acquired_at": "2026-08-14T17:53:43Z",
      "attribution": "Open Pinball Database contributors",
      "id": "opdb.snapshot.690f784a7968",
      "kind": "human_review",
      "license": "NOASSERTION",
      "locator": "machineGroups[GR0lW] and records GR0lW-MJPVV",
      "revision": "690f784a7968987e39ef20e1aff7bd15ea0d67385bafb5556a027802d2032c93",
      "sha256": "690f784a7968987e39ef20e1aff7bd15ea0d67385bafb5556a027802d2032c93",
      "uri": "https://mp-data.sfo3.cdn.digitaloceanspaces.com/latest-opdb.json"
    }
  ]
}
