{
  "family": {
    "id": "opdb.g5w9p.ed7509c4",
    "manufacturer": "Stern",
    "opdb_id": "G5W9p",
    "title": "Freefall"
  },
  "format": "pinmame-machine-family",
  "members": [
    {
      "machine_id": "stern.freefall.1981"
    }
  ],
  "schema_version": 1,
  "sources": [
    {
      "acquired_at": "2026-08-14T17:53:43Z",
      "attribution": "Open Pinball Database contributors",
      "id": "opdb.snapshot.690f784a7968",
      "kind": "human_review",
      "license": "NOASSERTION",
      "locator": "machineGroups[G5W9p] and records G5W9p-MJw0B",
      "revision": "690f784a7968987e39ef20e1aff7bd15ea0d67385bafb5556a027802d2032c93",
      "sha256": "690f784a7968987e39ef20e1aff7bd15ea0d67385bafb5556a027802d2032c93",
      "uri": "https://mp-data.sfo3.cdn.digitaloceanspaces.com/latest-opdb.json"
    }
  ]
}
