{
  "family": {
    "id": "opdb.gryzo.d5ffecfd",
    "manufacturer": "Sega",
    "opdb_id": "GRYzo",
    "title": "Golden Cue"
  },
  "format": "pinmame-machine-family",
  "members": [
    {
      "machine_id": "sega.golden-cue.1998"
    }
  ],
  "schema_version": 1,
  "sources": [
    {
      "acquired_at": "2026-08-14T17:53:43Z",
      "attribution": "Open Pinball Database contributors",
      "id": "opdb.snapshot.690f784a7968",
      "kind": "human_review",
      "license": "NOASSERTION",
      "locator": "machineGroups[GRYzo] and records GRYzo-MP3p7",
      "revision": "690f784a7968987e39ef20e1aff7bd15ea0d67385bafb5556a027802d2032c93",
      "sha256": "690f784a7968987e39ef20e1aff7bd15ea0d67385bafb5556a027802d2032c93",
      "uri": "https://mp-data.sfo3.cdn.digitaloceanspaces.com/latest-opdb.json"
    }
  ]
}
